{
  "name": "erc20-snapshot-balance-of-at",
  "desc": "Get the snapshot balance of an ERC20 token of an account and insters it into the stack",
  "operand": 0,
  "inputs": {
    "parameters": [
      {
        "name": "Token Address"
      },
      {
        "name": "Account"
      },
      {
        "name": "Snapshot Id"
      }
    ]
  },
  "outputs": 1,
  "aliases": ["erc20snapshotbalanceofat", "ierc20snapshotbalanceofat"]
}
