{
  "name": "ERC20_BALANCE_OF",
  "desc": "Get the balance of an ERC20 token of an account and insert it into the stack",
  "operand": 0,
  "inputs": {
    "parameters": [
      {
        "name": "Token Address"
      },
      {
        "name": "Account"
      }
    ]
  },
  "outputs": 1,
  "aliases": ["ERC20_BALANCE_OF", "ERC20BALANCEOF", "IERC20BALANCEOF"]
}
