{
    "name": "GREATER_THAN",
    "desc": "Takes last 2 values from stack and puts true/1 into the stack if the first value is greater than the second value and false/0 if not.",
    "operand": [],
    "inputs": {
        "parameters": [
            {
                "name": "1st Value"
            },
            {
                "name": "2nd Value2"
            }
        ]
    },
    "outputs": 1,
    "aliases": ["GT", "GREATERTHAN", "BIGGERTHAN", "BIGGER_THAN", ">"]
}
