{
  "name": "fp-scale18",
  "desc": "Rescale a fixed point number of N decimals to 18 decimals.",
  "operand": [
    {
      "name": "Inputs",
      "bits": [0, 2],
      "validRange": [[1, 2]]
    },
    {
      "name": "Rounding",
      "desc": "Direction to round truncation errors when scaling down. 0 = Down, 1 = Up.",
      "bits": [2, 3],
      "validRange": [[0, 1]]
    },
    {
      "name": "Current decimals",
      "desc": "Current decimals of the value being rescaled. Only used if inputs = 1.",
      "bits": [3, 15],
      "validRange": [[0, 77]]
    }
  ],
  "inputs": {
    "parameters": [
      {
        "name": "Value"
      }
    ]
  },
  "outputs": 1
}
