{
    "name": "FOLD_CONTEXT",
    "desc": "Performs a looped call over some inputs and some context rows specified by folding a column as start column index and width in operand arguments as length of items in rows",
    "operand": [
        {
            "name": "Inputs",
            "bits": [12, 15],
            "validRange": [[0, 15]]
        },
        {
            "name": "Width",
            "desc": "number of columns to loop over",
            "bits": [8, 11],
            "validRange": [[0, 15]]
        },
        {
            "name": "Fold Column",
            "desc": "column to base the loop on",
            "bits": [4, 7],
            "validRange": [[0, 15]]
        },
        {
            "name": "Source Index",
            "desc": "index of the source to run",
            "bits": [0, 3],
            "validRange": [[0, 15]]
        }
    ],
    "inputs": {
        "bits": [12, 15],
        "parameters": [
            {
                "name": "Input",
                "spread": true
            }
        ]
    },
    "outputs": {
        "bits": [12, 15]
    },
    "aliases": ["FOLDCONTEXT", "FOLD"]
}
