{
    "name": "EAGER_IF",
    "desc": "Takes 3 items from the stack and check if the first item is non-zero the inserts the second item into the stack, else inserts the 3rd item",
    "operand": [],
    "inputs": {
        "parameters": [
            {
                "name": "Condition",
                "desc": "The condition to evaluate"
            },
            {
                "name": "Pass Statement",
                "desc": "The value to stack if the condition is non-zero/true"
            },
            {
                "name": "Fail Statement",
                "desc": "The value to stack if the condition is zero/false"
            }
        ]
    },
    "outputs": 1,
    "aliases": ["EAGERIF", "IF"]
}
