{
    "name": "CONTEXT_ROW",
    "desc": "Inserts a context cell into the stack by reading the column from operand and row from stack",
    "operand": [
        {
            "name": "Column",
            "desc": "context column",
            "bits": [0, 7]
        }
    ],
    "inputs": {
        "parameters": [
            {
                "name": "Row"
            }
        ]
    },
    "outputs": 1
}
