{
  "name": "erc721-owner-of",
  "desc": "Get the owner of an ERC20 token of an account and insert it into the stack",
  "operand": 0,
  "inputs": {
    "parameters": [
      {
        "name": "Token Address"
      },
      {
        "name": "Token Id"
      }
    ]
  },
  "outputs": 1,
  "aliases": ["erc721ownerof", "ierc721ownerof"]
}
