{
  "name": "itier-v2-report-time-for-tier",
  "desc": "Inserts the specified tier level report of an account of a tier contract and optionally contexts which are taken from the stack into the stack",
  "operand": [
    {
      "name": "Inputs",
      "bits": [0, 7],
      "validRange": [[3], [4], [11]],
      "computation": "arg - 3"
    }
  ],
  "inputs": {
    "bits": [0, 7],
    "parameters": [
      {
        "name": "ITierV2 Address"
      },
      {
        "name": "Account"
      },
      {
        "name": "Tier"
      },
      {
        "name": "Context",
        "desc": "The contextual values",
        "spread": true
      }
    ]
  },
  "outputs": 1,
  "aliases": [
    "tier-report-time-for-tier"
  ]
}
