{
  "name": "ISZERO",
  "desc": "Checks if the value is zero and inserts true/1 into the stack if it is, else inserts false/0",
  "operand": 0,
  "inputs": {
    "parameters": [
      {
        "name": "Value"
      }
    ]
  },
  "outputs": 1,
  "aliases": ["IS_ZERO", "FALSE", "IS_FALSE", "ISFALSE"]
}
