{
  "name": "scale-by",
  "desc": "Scale a fixed point up or down by operand.",
  "operand": [
    {
      "name": "Scale",
      "desc": "determines the up/down scale as 2s complement",
      "bits": [0, 7]
    }
  ],
  "inputs": {
    "parameters": [
      {
        "name": "Value",
        "desc": "The value to scale by"
      }
    ]
  },
  "outputs": 1,
  "aliases": ["scaleby"]
}
