{
    "name": "IVERFYV1_ACCOUNT_STATUS_AT_TIME",
    "desc": "Read and put the status of an account from the verify v1 contract into the stack",
    "operand": 0,
    "outputs": 1,
    "inputs": {
        "parameters": [
            {
                "name": "IVerifyV1 Address"
            },
            {
                "name": "Account Address"
            }
        ]
    },
    "aliases": ["VERIFY_STATUS", "VERIFYSTATUS"]
}
