{
  "name": "erc20-snapshot-total-supply-at",
  "desc": "Get the snapshot supply of an ERC20 token and insert it into the stack",
  "operand": 0,
  "inputs": {
    "parameters": [
      {
        "name": "Token Address"
      },
      {
        "name": "Snapshot Id"
      }
    ]
  },
  "outputs": 1,
  "aliases": ["erc20snapshottotalsupplyat", "ierc20snapshottotalsupplyat"]
}
