{
    "name": "ISALEV2_REMAINING_TOKEN_INVENTORY",
    "desc": "The remaining rTKNs left to to be sold",
    "operand": [],
    "inputs": {
        "parameters": [
            {
                "name": "ISale Address"
            }
        ]
    },
    "outputs": 1,
    "aliases": ["REMAINING_UNITS"]
}

